<?xml version="1.0" encoding="iso-8859-1"?>
<!DOCTYPE Grains2D SYSTEM "../../dtd/Grains2D.dtd">

<Grains2D Type="Standard">
  <Construction>

    <Recipient LX="0.03" LY="0.05" LZ="0."/>

    <Obstacles>
      <Composite name="Boite">
	<Obstacle name="Droite">
	  <Convex RayonInteraction="1.e-5">
	    <Box LX="0.002" LY="0.10" LZ="0."/>
	  </Convex>
	  <Centre X="0.026" Y="0.05" Z="0."/>
	  <Orientation Type="Unite"></Orientation>
	  <Materiau>matO</Materiau>
	  <Couleur R="0." V="1." B=".1"/>
	</Obstacle>

	<Obstacle name="Gauche">
	  <Convex RayonInteraction="1.e-5">
	    <Box LX="0.002" LY="0.10" LZ="0."/>
	  </Convex>
	  <Centre X="0.004" Y="0.05" Z="0."/>
	  <Orientation Type="Unite"></Orientation>
	  <Materiau>matO</Materiau>
	  <Couleur R="0" V="1" B="0"/>
	</Obstacle>

	<Obstacle name="Bas0">
	  <Convex RayonInteraction="1.e-5">
	    <Box LX="0.030" LY="0.002" LZ="0."/>
	  </Convex>
	  <Centre X="0.015" Y="-.0005" Z="0."/>
	  <Orientation Type="Unite"></Orientation>
	  <Materiau>matO</Materiau>
	  <Couleur R="0." V=".75" B="0."/>
	</Obstacle>

	<Obstacle name="Bas1">
	  <Convex RayonInteraction="1.e-5">
	    <Box LX="0.010" LY="0.002" LZ="0."/>
	  </Convex>
	  <Centre X="0.015" Y="0.0005" Z="0."/>
	  <Orientation Type="Unite"></Orientation>
	  <Materiau>matO</Materiau>
	  <Couleur R="0." V=".75" B="0."/>
	</Obstacle>
      </Composite>
    </Obstacles>

  </Construction>

  <Forces>
  </Forces>

  <Simulation>

    <Temps Debut="0." Fin="1.e-5"/>
    <IncreTemps dt="1.e-5"/>
    <TempsSave Debut="0." Fin="1." Dt="0.001"/>
    <Fichier>paroi</Fichier>
  </Simulation>

</Grains2D>
