<?xml version="1.0" encoding="iso-8859-1"?>
<!DOCTYPE Grains2D SYSTEM "../../dtd/Grains2D.dtd">

<Grains2D>
  <Construction>
    <Recipient LX="0.03" LY="0.05" LZ="0.0"/>

    <Reload Fichier="p25" Vitesse="Reset"/>
  </Construction>

  <Forces>
    <Gravite GX="0." GY="9.81" GZ="0."/>
  </Forces>

  <Simulation>
    <Temps Debut="0.0" Fin="0.3"/>
    <IncreTemps dt="1.e-5"/>
    <TempsSave Debut="0.0" Fin="1.0" Dt="0.01"/>
    <Fichier>p25Move</Fichier>

    <Chargements>
      <Chargement NomObstacle="Bas1" Mode="Translation">
	<Temps Debut="0." Fin="0.25"/>
	<Vecteur X="0." Y="0.01" Z="0."/>
      </Chargement>
    </Chargements>

  </Simulation>
</Grains2D>
